{
  "Work Provider": "YML",
  "VRM": "DE14",
  "Vehicle Model": "due course.",
  "Claimant Name": "’s vehicle was",
  "Reference": "HD4009",
  "Incident Date": "04/05/2026",
  "Instruction Date": "05/05/2026",
  "Inspection Date": "31/05/2026",
  "Inspection Address": "8 Dale St\n\n\n\n\nDE14 3TE",
  "Accident Circumstances": "'The Claimant’s vehicle was\nstationary in the car park at Derby Railway Station when the Defendant reversed out of a parking\nbay and collided with the offside of the Claimant’s vehicle.' As a result of the collision we request\nthat you inspect our Client's vehicle at the address mentioned below and forward to us the report in\ndue course.",
  "VAT Status": "",
  "Mileage": "",
  "Mileage Unit": ""
}