{
  "Work Provider": "AX",
  "VRM": "PN64WBO",
  "Vehicle Model": "RENAULT CLIO DYNAMIQUE MEDIANAV",
  "Claimant Name": "Miss Stevie-Leigh Reynolds",
  "Reference": "1063118",
  "Incident Date": "29/04/2026",
  "Instruction Date": "Engineer Instructions",
  "Inspection Date": "",
  "Inspection Address": "Image-based Assessment\n\n\n\n\n",
  "Accident Circumstances": "Our client was proceeding down Crammond Ave - Third Party has failed to\ngiveway and pulled out of Aitkenhead Ave and collided into the Nearside of\nour clients vehicle. Details Exchanged",
  "VAT Status": "",
  "Mileage": "",
  "Mileage Unit": ""
}