{
  "Work Provider": "ALISON",
  "VRM": "SJ12MRY",
  "Vehicle Model": "SJ12 MRY",
  "Claimant Name": "Nisa Dakhrun",
  "Reference": "HA:MA:BFD/25/42518.001",
  "Incident Date": "08/10/2025",
  "Instruction Date": "17/10/2025",
  "Inspection Date": "31/05/2026",
  "Inspection Address": "63 Worthington Street\nBradford\n\n\n\nBD8 8RX",
  "Accident Circumstances": "",
  "VAT Status": "",
  "Mileage": "",
  "Mileage Unit": ""
}