{
  "Work Provider": "KERR",
  "VRM": "YD72KZX",
  "Vehicle Model": "Skoda Octavia 1.4 TSI iV 13kWh SE Technology DSG Euro 6 (s/s) 5dr 2022 silver",
  "Claimant Name": "Samual Stephen",
  "Reference": "AD/VRL/1/5241",
  "Incident Date": "28/02/2026",
  "Instruction Date": "10/03/2026",
  "Inspection Date": "31/05/2026",
  "Inspection Address": "19A Garrier Road\nSpringside\nIrvine\n\n\nKA11 3AT",
  "Accident Circumstances": "",
  "VAT Status": "",
  "Mileage": "",
  "Mileage Unit": ""
}